{
  "contract_set_version": "1.0.0",
  "document_id": "inv_corpus_medium_02",
  "difficulty": "medium",
  "challenge_tags": [
    "explicit_company_name",
    "ein_present"
  ],
  "expected_review": {
    "manual_review_required": false,
    "review_reason": null
  },
  "expected_vendor_candidate": {
    "company_name": {
      "value": "Gulf Stream Co.",
      "present": true,
      "inferred": false
    },
    "address": {
      "street_1": "70 Coral Ct",
      "street_2": null,
      "city": "Miami",
      "state": "FL",
      "postal_code": "33101",
      "country": "US"
    },
    "tax_ids": {
      "ein": "78-9012345",
      "state_tax_id": null,
      "vat_id": null,
      "other_tax_id": null
    },
    "website": "https://gulfstream.example.com",
    "phone": "+1 305-555-0160",
    "email": "ap@gulfstream.example.com"
  }
}
