{
  "contract_set_version": "1.0.0",
  "document_id": "inv_008_medium",
  "difficulty": "medium",
  "challenge_tags": ["explicit_company_name", "website_present", "remit_to_differs_from_vendor"],
  "expected_review": {
    "manual_review_required": false,
    "review_reason": null
  },
  "expected_vendor_candidate": {
    "company_name": {
      "value": "Southwest Gas",
      "present": true,
      "inferred": false
    },
    "address": {
      "street_1": "1631 W Craig Rd",
      "street_2": "Suite 2",
      "city": "North Las Vegas",
      "state": "NV",
      "postal_code": "89032",
      "country": "US"
    },
    "tax_ids": {
      "ein": null,
      "state_tax_id": null,
      "vat_id": null,
      "other_tax_id": null
    },
    "website": "swgas.com",
    "phone": "877-860-6020",
    "email": null
  }
}
