{
  "contract_set_version": "1.0.0",
  "document_id": "inv_corpus_easy_05",
  "difficulty": "easy",
  "challenge_tags": [
    "explicit_company_name",
    "ein_present",
    "website_present"
  ],
  "expected_review": {
    "manual_review_required": false,
    "review_reason": null
  },
  "expected_vendor_candidate": {
    "company_name": {
      "value": "Elm Industries",
      "present": true,
      "inferred": false
    },
    "address": {
      "street_1": "5 Birch Ln",
      "street_2": null,
      "city": "Chicago",
      "state": "IL",
      "postal_code": "60601",
      "country": "US"
    },
    "tax_ids": {
      "ein": "56-7890123",
      "state_tax_id": null,
      "vat_id": null,
      "other_tax_id": null
    },
    "website": "https://elmind.example.com",
    "phone": "+1 312-555-0140",
    "email": "ap@elmind.example.com"
  }
}
