{
  "contract_set_version": "1.0.0",
  "document_id": "inv_missing_violation_mrr",
  "difficulty": "missing_name",
  "challenge_tags": [
    "missing_company_name"
  ],
  "expected_review": {
    "manual_review_required": true,
    "review_reason": "company_name_inferred"
  },
  "expected_vendor_candidate": {
    "company_name": {
      "value": "Acme Widgets",
      "present": false,
      "inferred": true
    },
    "address": {
      "street_1": "123 Main St",
      "street_2": null,
      "city": "Boston",
      "state": "MA",
      "postal_code": "02110",
      "country": "US"
    },
    "tax_ids": {
      "ein": "12-3456789",
      "state_tax_id": null,
      "vat_id": null,
      "other_tax_id": null
    },
    "website": "https://acme-widgets.example.com",
    "phone": "+1 617-555-0100",
    "email": "billing@acme-widgets.example.com"
  }
}
