{
  "contract_set_version": "1.0.0",
  "document_id": "inv_corpus_medium_04",
  "difficulty": "medium",
  "challenge_tags": [
    "explicit_company_name",
    "ein_present"
  ],
  "expected_review": {
    "manual_review_required": false,
    "review_reason": null
  },
  "expected_vendor_candidate": {
    "company_name": {
      "value": "Indigo Paper Co.",
      "present": true,
      "inferred": false
    },
    "address": {
      "street_1": "90 Press Ave",
      "street_2": null,
      "city": "Philadelphia",
      "state": "PA",
      "postal_code": "19101",
      "country": "US"
    },
    "tax_ids": {
      "ein": "90-1234567",
      "state_tax_id": null,
      "vat_id": null,
      "other_tax_id": null
    },
    "website": "https://indigopaper.example.com",
    "phone": "+1 215-555-0180",
    "email": "ap@indigopaper.example.com"
  }
}
