{
  "contract_set_version": "1.0.0",
  "document_id": "inv_017_missing_name",
  "difficulty": "missing_name",
  "challenge_tags": ["missing_company_name", "email_domain_present", "remit_to_differs_from_vendor"],
  "expected_review": {
    "manual_review_required": true,
    "review_reason": "company_name_inferred"
  },
  "expected_vendor_candidate": {
    "company_name": {
      "value": "Desert Flow Plumbing",
      "present": false,
      "inferred": true
    },
    "address": {
      "street_1": "4217 W Desert Inn Rd",
      "street_2": "Suite B",
      "city": "Las Vegas",
      "state": "NV",
      "postal_code": "89102",
      "country": "US"
    },
    "tax_ids": {
      "ein": null,
      "state_tax_id": null,
      "vat_id": null,
      "other_tax_id": null
    },
    "website": null,
    "phone": "(702) 555-0143",
    "email": "billing@desertflowplumb.example.com"
  }
}
