{
  "contract_set_version": "1.0.0",
  "document_id": "inv_018_missing_name",
  "difficulty": "missing_name",
  "challenge_tags": ["missing_company_name", "email_domain_present", "ein_present", "state_tax_id_present", "remit_to_differs_from_vendor"],
  "expected_review": {
    "manual_review_required": true,
    "review_reason": "company_name_inferred"
  },
  "expected_vendor_candidate": {
    "company_name": {
      "value": "Office Stream Pro",
      "present": false,
      "inferred": true
    },
    "address": {
      "street_1": "5500 Industrial Pkwy",
      "street_2": null,
      "city": "Reno",
      "state": "NV",
      "postal_code": "89506",
      "country": "US"
    },
    "tax_ids": {
      "ein": "88-3142059",
      "state_tax_id": "1020-44781",
      "vat_id": null,
      "other_tax_id": null
    },
    "website": null,
    "phone": "(775) 555-0108",
    "email": "orders@officestreampro.example.com"
  }
}
